<?xml version="1.0" encoding="UTF-8"?>
<!--
	<H3>Workflow Management System</H3>

	Can be used to launch the workflow management system.<br>
-->
<componenttype xmlns="http://www.activecomponents.org/jadex-component"
	xmlns:xsi="http://www.w3.org/2001/XMLSchema-instance"
	xsi:schemaLocation="http://www.activecomponents.org/jadex-component
						http://www.activecomponents.org/jadex-component-2.0.xsd"
	name="WfMS" package="jadex.wfms">
	
	<imports>
		<import>jadex.wfms.service.*</import>
		<import>jadex.wfms.service.impl.*</import>
	</imports>

	<componenttypes>
		<componenttype filename="jadex/wfms/components/Monitoring.component.xml" name="wfms_monitoring"/>
		<componenttype filename="jadex/wfms/components/UserManagement.component.xml" name="wfms_users"/>
		<componenttype filename="jadex/wfms/components/Execution.component.xml" name="wfms_execution"/>
		<componenttype filename="jadex/wfms/components/WorkitemManagement.component.xml" name="wfms_workitems"/>
		<componenttype filename="jadex/wfms/components/Access.component.xml" name="wfms_access"/>
		<componenttype filename="jadex/wfms/client/standard/StandardClientAgent.class" name="std_client"/>
	</componenttypes>
	
	<services>
	</services>
	
	<properties>
		<property name="componentviewer.viewerclass">"jadex.wfms.WfmsViewerPanel"</property>
	</properties>
	
	<configurations>
		<configuration name="Workflow Management System (1 Standard Client)">
			<components>
				<component name="wfms_monitoring" type="wfms_monitoring"/>
				<component name="wfms_users" type="wfms_users"/>
				<component name="wfms_execution" type="wfms_execution"/>
				<component name="wfms_workitems" type="wfms_workitems"/>
				<component name="wfms_access" type="wfms_access"/>
				<component name="client" type="std_client"/>
			</components>
 		</configuration>
 		
 		<configuration name="Workflow Management System (No Clients)">
			<components>
				<component name="wfms_monitoring" type="wfms_monitoring"/>
				<component name="wfms_users" type="wfms_users"/>
				<component name="wfms_execution" type="wfms_execution"/>
				<component name="wfms_workitems" type="wfms_workitems"/>
				<component name="wfms_access" type="wfms_access"/>
			</components>
 		</configuration>
	</configurations>

</componenttype>
