<?xml version="1.0" encoding="UTF-8"?>
<!--
	<H3>Banking agent that offers a banking service.</H3>

    This example shows how a Jadex service can be automatically published
    as web service with a synchronous interfaces.
    
    The @Publish annotation requires the publishing type (e.g. web service),
    the id (e.g. a web service url) and the service type, i.e. interface to
    be specified.
-->
<componenttype xmlns="http://jadex.sourceforge.net/jadex"
	xmlns:xsi="http://www.w3.org/2001/XMLSchema-instance"
	xsi:schemaLocation="http://jadex.sourceforge.net/jadex
						http://jadex.sourceforge.net/jadex-component-2.0.xsd"
	name="Banking" package="jadex.webservice.examples.ws.banking">
	
	<imports>
		<import>jadex.extension.ws.publish.*</import>
		<import>jadex.webservice.examples.ws.offerquote.gen.*</import>
	</imports>
	
	<services>
		<providedservice class="IBankingService">
			<implementation class="BankingService"/>
			<publish publishtype="ws" publishid="http://localhost:8080/banking" mapping="IWSBankingService"/>
		</providedservice>
	</services>
</componenttype>	

